review,sentiment
two hand highly enjoyable aussie crime caper ultimately succeeds way film easily combine tense dramatic moment funny character situation give film right balance feel comedy film occurs naturally laugh set elaborately worked really funny thanks fact character movie excellently cast actor actress recognises relate aussie humor portray well realistically course helped immensely fantastic script writer director gregor jordan reading another review film american seen heavily criticised basically passing pulp fiction clone think rubbish film trying pulp fiction feel style excellent film totally opposite without wanting sound superior arrogant think fully understand film humor sincerity character etc australian least understand culture guy obviously faintest clue american whose review certain non american film seem ignorant trouble comprehending anything american product real shame really great film love story featured main character girl also portrayed real sincere sweet way proud film collection,1
rap book movie based one difficult book ever read yet could put raunchy crude foul lewd name also best characterization novel ever read br br well flick deplorable mean tim mcintire wasco wasco baddest mutha talking bout wasco mcintire wasco like casting tim conway charles manson br br happened main character book little arv even exist movie fast walking main dude book even name credit thing rap none spirit atmosphere nastiness drama book captured movie br br disappointment total waste time celluloid,0
wish show would come back television greatest show ever make episode episode course would confusing wish would come back make episode please come back show absolutely hilarious laugh without seeing episode really funny part every episode plus show much better hyde jackie going best episode show best always best show ever really sad show ended make new episode,1
movie entertainment imagine friend love spending time one know inside becoming bit silly perhaps taking character two film inventive script brilliantly performed pleasing mass one fun bunch brilliantly talented people sure thought signed br br review sound completely unfair think person wrote wrong frame mind watched film lighthearted moment great dignity care look br br job well done thought great film watch north american norm day br br nutshell best film ever going see hell lot moment laughed long age,1
yes movie hilarious acting top notch whole cast except shelley winter german accent great matter hardly film fan beware two main star film laurence harvey julie harris film see miss harris east eden james dean audio tape glass menagerie stage monty clift jessica tandy sure role boy impress hammy love ham mr harvey tickled fancy full time laurence harvey fan hair cackle omg almost like burt lancaster crazy messy look get better young innocent film see definitely top ten glad found copy mine unfortunately movie print hard find video br br btw watch hospital hotel room scene one best part mr harvey convinced ill trying get knee kick know doctor little rubber hammer well leg kick kick table squeal check look face innocent describe people say act well cockamamie comment see film see great actor really bowled afraid nothing hopeless,1
saw australian film year ago never forgotten movie show horror war way hollywood usually gloss relationship soldier two warring country highlighted difference culture ultimate knowledge end really different inside find type copy buy rent disappointed awed,1
sleepless night switching channel found embarrassment movie thinking br br life remote control kari wuhrer salin wonder gone nowhere br br david keith take role pathetic br br anyway turned movie near end get much plot must best part nerdy college kid brings home dominatrix ish girl scene straight comic book cheap porn movie call mother anal retentive kiss father oh expect tongue great line br br see ended br br well course bitch hell helluva past swat team upstairs yes surround yes yes kid blow brain ahahhahahaha br br must see tv br br,0
moonwalker probably film watch michael jackson fan big fan enjoyed majority film ending fantastic first minute fan br br personally believe first minute watchable many time dancing video breathtaking music fantastic listen dialogue entertaining br br includes many finest video bad snippet earlier video also includes live concert footage br br big fan michael jackson must fan like michael jackson steer well clear br br,1
secret service agent jay killion charles bronson assigned protect president elect wife new first lady jill ireland difficult woman killion hand full victim numerous assassination attempt directed president chief staff want first lady dead movie insult intelligence story line also lack realistic location example scene depicting inaugural parade first lady roll royce convertible agent killion without president also know washington dc like weather wise january everybody top coat less even see palm tree degree sunny weather obviously filmed hollywood washington dc movie joke worth time,0
mainly ju boast outrageous forty minute worth material literally taken straight first ju consider sequel run minute leaf original minute worth film ho hum found deeply irritating viewer simply remember stuff mention dull watch br br ok complaint aside byline ju supposed explain lot unanswered question first movie frankly minute simply go far enough making kind sense original highly convoluted storyline br br however really nice new horror sequence show good film might time develop question raised original answered br br conclusion loved first original movie want see development story go remember keep remote control hand finger fast forward button forty minute,0
never impressed night gallery one episode stand br br tv network executive audition odd act young nerdy boy proceeds make prognostication exec dismisses whole thing flaky waste time prediction come true next morning br br first seemed parlor act becomes hit show kid prediction prove consistently accurate br br one day refuse show facing imminent showtime everyone wit end even threatening legal action fulfill contract make daily prediction br br young boy relents foretells seemingly utopian tomorrow br br show befuddled executive asks explanation learn complete truth terrifying reveal,1
back really lengthy vacation around fourth july something like day row two week paid vacation weekend holiday stayed town time hanging parent house lot br br tv apartment used watch parent tube finished watching segment x file program came called personal fx hooked instantly always fascinated item home come parent family home inheritance relative estate often wondered history value etc br br long vacation used go folk house lunch hour catch personal fx br br remember one episode co host claire carter announced new york apartment series filmed renovated said renovation complete personl fx would return air br br never personal fx first best collectible show vanished air almost fifteen year later still sore br br way go fx,1
watching movie think last year must say never felt bad felt watching extra large bore movie bad bad song song nobody watch movie director shown german speaking english rubbish german speak english one scene white girl asked himesh autograph obv must gave money promo shown prepare laughing riot could say one scene himesh laughing reason may think funny hansika good like angel young yr old plenty time know watch movie else waste money,0
even though first film broken lizard group last one saw mildly enjoyed super trooper managed sit crap club dred beerfest surprised hear earlier film sit high hope hoping funny campus romp friend asked keep mind younger obviously first foray film still disappointed taking away acting comedy skill bl guy ok whole film tiresome clichéd frankly boring actor film really poor acting rugby game even resemble rugby poor showing improved drastically super trooper declined since let hope get back form super trooper,0
really disappointed movie great actor potentially great plot seemed limp along br br charlize theron masterful role beautiful seemed like screen work car chase done austin mini product placement gone wrong wrong br br direction seemed edward norton bad guy obvious right start every time camera would pas would linger long norton would grimace something c mon hollywood give u little credit okay surprise u plot twist without telegraph br br sorry movie average always one appreciate work talent go movie one,0
watching half movie noticed something peculiar found constantly switching tv channel see else exactly good movie trait br br movie listed number genre must say mostly failed misserably every one movie switched watch old rerun instead bottom line whole movie felt one making exactly know make ended concoction discernable taste,0
writer director peter greenaway cement title high lord art house pretension latest exercise obnoxious self indulgence ½ woman film follows wealthy englishman son mutual quest sexual satisfaction lure blackmail woman guess many joining personal collection concubine br br think possible way premise could offensive chance greenaway done female character little catalogue fetish two protagonist partake kabuki obsessed mio ever pregnant giaconda beryl got thing farm animal giulietta leg us wheelchair half woman get greenaway vehemently denies accusation misogyny br br film go eroticize anything everything japan continuation theme snore worthy less sexist film pillow book pillow book erotic graceful ½ woman get horny exploitative greenaway work tasteless arrogant fetishism person likely enjoy watching auteur,0
start guy indian pot cleaning suddenly skeletor attack hit woman neck axe fall get apparently uninjured run wood turn basement shopping center wood meet utility worker skeletor attack luckily like good utility worker got gun shoot guy work everything start fire br br cut people walking wood even though hiking together time sit introduce probably done first met anyhow undercover delta team member undercover suppose way pay dress uniform cute girl various thing sniper school instructor oh remember rest matter eventually take gun immediately start aiming various thing anyhow meet old indian sitting wood want bean know like pork bean mumble stuff assume premise movie relied heard premise commercial really understand anything say br br walk around wood dialogue load quasi military macho b mean every single word like reminds kabul reminds lao skeletor attack let give rundown basic attack one female character crouched behind tree aim gun approaching guy horse reason fire yell several time someone else skeletor approach jump behind tree skeletor stick spear everybody start shooting bullet cause spark fly tree apparently folk made movie never shot tree bullet make spark br br casper van diem sudden driving semi truck trying run skeletor miss truck slide stop van diem injured apparently slid across seat bumped hip window crank something crawl truck explodes later wood dying everybody say bunch quasi military macho b meet couple guy wood blow undercover status immediately identifying army beat guy reason go away br br stuff happens people mumble camera shake etc br br think come end eventually br br theory sci fi channel getting little annoyed everyone bashing movie put remind u bad movie really like think movie bad well seen bad bad okay got way rest movie pretty good comparison right br br well theory,0
um serious film troubled teen singapore country much knowledge previous wrong impression kid highly disciplined controlled family government well guess wrong like city country also troubled teen also lead surprising rebellious way life drug fight bad language many obvious sign bad boy surprising part film really kid running around causing others trouble rather subtle gayness hidden behind call loyalty bond brother may well originated unconscious gay tendency inside boy though uncommon str guy close friendship watch film closely entering sort gay film festival would surprised may win lot award toward direction,1
caution several spoiler br br someday somewhere going post apocalyptic movie made stink unfortunately postman movie though give credit trying br br kevin costner play somebody credited postman actually postman wanderer mule wasteland western america devastated unspecified catastrophe trade isolated village performing shakespeare suddenly pack bandit called holnists self declared warlord west descend upon village costner visiting evil leader gen bethlehem patton draft costner much misery numerous effort break costner spirit escape thus ending lengthy section movie could told better three minute flashback br br finally get major premise escaped costner find abandoned mail truck delivers letter nearest town hoping get food pretense postman number village people led young ford larenz tate want get postman act sit well bethlehem bandit costner find unwitting unwilling leader band postman war holnists br br idea postman versus bad guy ridiculous sound holnists depend livelihood fact village prey isolated one another holnists destroy one village could stand victim united unite village must communicate one another working mail system would thus big step toward putting holnists business really make lot sense bethlehem would get medieval heroic mail carrier unfortunately bethlehem eventual defeat result village uniting instead old standby cliche one one brawl costner even real attempt community use mail work together solve problem mail seems standard hi aunt debbie stuff played maximum sentimental value br br postman one predictable movie shot shot ever seen purposely try ruin movie straining figure going happen next talking kind predictability requires effort knew going happen next whether wanted know lion prominently showcased eating people holnist bandit seeking escaped costner venture bush noise shocked lion eats bunch unoffending villager rounded shot firing squad one villager sings famous last word right shot immense lack surprise covered statue unveiled show exactly everyone knew going costner bending pick letter cutesy kid saw earlier movie man tell bethlehem sir take wife bethlehem run unsuspecting sod though person theater unsuspecting br br rank cloying sentimentality really undoes postman olivia williams playing costner lover abby worst served pours heart material give best effort make sound natural sincere try hard heart breaking nobody could ever made line gift postman give hope like candy pocket sound like anything syrupy pap another example scene mounted costner thunder past little boy ignoring proffered letter turn around stare seems like five minute thunder back pick letter costner pick first time real reason artifice try fails give u feeling elation dashing kid hope restoring br br schmaltz predictability unite end statue postman revealed sat thinking please tell going show statue cut back scene cutesy kid surely saccharine obvious even movie ala music swelled indeed cut back dreaded little boy smiling letter maiden aunt whisked away held head hand thought somebody shoot felt like thirty pound apple pie rammed throat br br gen bethlehem humanized villain normal standard issue post apocalyptic villain meanest toughest b valley bethlehem shown little nothing man inside try make feel important beating others although menace thereby sacrificed bethlehem credible way villain unfortunately patton overacts although told early bethlehem utterly destroyed last challenger five second hand hand combat bethlehem actual fighting skill shown end movie absolutely ludicrous br br acting otherwise pretty good costner done better razzie overreaction mentioned olivia williams impressive larenz tate ford sincere credible job james newton howard score competent though short epic standard movie going enough save film br br rating,0
routine suspense yarn sociopath dillon give sperm clinic human reproduction start harrass life woman antony husband mancuso extremely predictable far fetched undecided tone way lose time one make baby instead,0
based one book gabriel marquez might brilliant literature cinema adaption really suck like fighting sleep rather enjoying cinematographic delices story old couple whose son died living life heavily dominated poverty wherein main character cock hopefully one day brings money forthcoming cockfight mood spill word useless pretentious piece perhaps see salma hayek sitting minute front screen gracias,0
okay grew loved doctor since tom baker christopher eccleston made love furious forever leaving br br writing grand acting superb directing dreadful old day fantastic skeptical programme watched merely forced huge fan love ringtone dalek screaming exterminate br br thing love new programme people actually notice rose billie piper disappears planet old show assistant would drop come home like nothing happened one noticed chris eccleston doc love rose romantic debated doubt love care companion destroy world save old show lacking often doctor care never saw assistant talk think like real people rose shown something outlandish new alien act like real person would gobsmacked never liked assistant old show never saw anything alien would fit right adapt instantly want see surprise rose face see plastic dummy come life give br br thing like series nearly everything happens earth london cardiff sort hoping world sort show eccleston left quickly really made show brilliant br br let thing go far enjoy series ever expected mind stuff set earth br br take show seriously fun smart entertaining super serious heavy duty show pure fun pure british get enough watch open mind put brain neutral enjoy br br p watch series later series brilliant first episode series good watch get love monster utter rubbish completely destroys show,1
plot film contains hole could drive massive truck reckon always top priority horror two elderly sister rural england keep brother cellar since year escaped started killing spree focusing military homed nearby thought best keep repeating  strangely  army officer love woman doubt sincerity even though men died know whether find revelation near end suspenseful tedious way film reminded arsenic old lace black comedy classic two half insane sibling mother goofy younger brother well yet killing old lady beast cellar mean less crazy though horror early film amateurish cheap neat attempt build tension many old lady talk good ol day though rarely something seek horror film appealing title flora robson may recognized classic film buff play one sister gave image queen england legendary errol flynn swashbuckler film sea hawk,0
main reason see film warren william top form shyster campaign manager electric constantly finding way fool public defeat opposing party midst biggest disaster william great actor feel never got due bette davis girlfriend also shine written role personally found guy kibbee quite right lame brained candidate william others trying foist public seemed like empty canvas person would preferred see real character emerge rather non character story implausible silly clichéd warren william bette davis well worth watching,1
earth become dear ramu man made sarkar satya comapny refuse believe aag ramu ambitious project clearly jumped high cliff ascended giving industry greatest work time movie made fall like brick cringing leave theater forced sit able take car parking lot others also left else nothing would made sit beyond interval br br movie nowhere close sholay even come near within mile believe ramu surely love godfather sholay since sarkar classic piece work read ramu interview couple day back interviewer said ramu sleep hour day stretch completely agree lack sleep probably taken toll movie br br power performance amitabh bachchan even look scary looked terrifying poster wallpaper saw earlier ramu favorite nisha kothari fantastic job sarkar many dialog fact none remember clearly opened mouth movie found place history new guy playing jai role seems brash look manage jai role cant go im sorry pain big manage right br br promised throughout movie watch original sholay see still br br bottom line horrible movie medium critic going cook ramu goose remind reader one biggest ramu fan even cant spare act,0
film worthwhile despite may hear performance marie dressler hope spelling right drunken old sot reason enough see film amazing performance drunken stupor three scene good long never thing twice actually smell alcohol done amazing greta course speaks first line film shes great eugene neill story solid like neill story deep intense light entertainment appreciate great character actor like film technically fuzzy worthwhile,1
one considers carson mccullers one foremost literary figure th century seems need great lack talent able ruin one story movie show done actor ingratiate way becoming director wooden unatmospheric unsympathetic totally sync poetic compassion mccullers writing jaw dropped horror disbelief mish mash movie could ever found finance backer redeeming feature moderately good acting although said vanessa redgrave seems permanently render much performance whatever character play good cinematography place otherwise bitter bitter disappointment could indeed contemporary masterpiece simon callow hang head shame stick acting,0
look know may suck right pain temporary film forever whatever right burned celluloid time thousand year come  robert de niro br br initially film steven spielberg director hiring several screenwriter adjust screenplay suited theme dysfunctional family threatened deranged monster form recently released prison robert de niro like jurassic park poltergeist war world dysfunctional family band together defeat beast beast creation father lawyer failed defend de niro trial br br typical spielberg fashion father kill monster undermines family promptly absolved sin like oscar schindler robin williams sam niel tom cruise virtually every daddy figure spielberg land father reclaims paternal duty kind bittersweet coda spielberg enjoys br br spielberg eventually abandoned picture project instead turned martin scorsese time seeking try hand commercial fare result arguably worst film scorsese filmography ironically illuminating br br artist failure misfire often revealing exposing inner working art story work character connect image sear find left kind inner core  remaining carcass director cinema br br cape fear impersonal film find thematic connection rest scorsese filmography already sacrificed de niro yell film theme catholic redemption cookie cutter film though expose kind language filmography hinge watch scorsese camera desperately whip back forth zoom frantically onto doorknob window attempt force tension character loud screaming attention importantly watch film make spatial sense showdown boat end film take place obvious sound stage street parade claustrophobic take place within larger context family house seem exist anywhere particular simply geographical sense anything picture scorsese unable film space create kind spatial environment br br reason scorsese camera always bound intimately tethered central character world around character make sense camera focused character resnais take around french hotel welles hitchcock dance street building cameron give tour titanic scott recreate entire future cityscape lucas give alien desert planet director create sense space textbook close mid shot wide shot combination scorsese poetry sense tangible space film character break tether leave boxing ring taxi cab look away de niro everything collapse simply cannot break away documentarian style shooting way prerequisite action film making br br scorsese tried rectify problem gang new york space set become central character even self consciously spatial experiment get sabotaged magnetism daniel day lewis actor drawing scorsese camera inexorably toward like moth bulb br br  even generic b movie ugly vulgar looking film look matte painting inept attempt tension silly rotorscoped special effect hokey fistfight showdown still robert de niro pick slack de niro give body scorsese like tattooed christ give film great scene improvised romantic sequence young juliette lewis stick thumb mouth kiss kind symbolic rape girl run away aroused repelled man interest br br de niro performance deliciously top simply imitated scorsese need operatic tone baroque visuals someone like de palma make work scorsese nope br br worth one viewing,0
one beautiful moving thought provoking film around good family entertainment time make think hard issue involved every time see ghost zac riding bike puddle end help cry eye john thaw performance touching shame longer u gone forgotten outstanding film full mark,1
program would useful training hardened felon basic human emotion beyond purpose show value fill bandwidth would otherwise go unutilized electromagnetic spectrum feel greater sense suspense anticipation listening computerized voice chip endlessly droning product random number generator fortunately helpful frequent music cue tell viewer supposed feel case unable fully internalize predictable shallow plot line find amy superficially positive character role model young woman serve traditionally male field unfortunately totally subjective approach law guided solely whatever capricious personal guideline amy elect employ resulting amy trial closely resembling appeal personal mercy tribal despot true administration justice show unpalatable amount although extent mitigated two episode brain god given filtering process show thankfully leave imprint viewer memory television tuned dead channel maximum volume,0
