review,sentiment
holy movie still warm juicy pile made tried watch pile festering waste found easier slash wrist slug back shooter lysol floor cleaner endure half crap screen rank well anything ever watched film tv thats saying something witnessed cow crap field watched steaming pile hour half know might moved something well time better spent watching tripe acting non existent plot somewhere film think saw cut seen early plot managed escape riding background back old pickup truck heading portland hope becoming steven king shier please tell director getting medication desperately need pretty clear need heavy medication willing front money needed lobotomy reversal bah give review full punch need nothing painful ever done justice typed word alone let say looking flick pas time see chilton rack walk car start engine shove fist straight fan feel bone vibrate anymore sure wallet hand also going waste cash anyway might well privilege wasting br br way watched buddy mine sent girlfriend could see dint come whats worse watch thing twice heard married get visit ball month hope film,0
writer trying create character scrub different occupation however character stuck charisma acting ability mention writing seems poor effortless guy trying create something would good writing disgusting leaving show lifeline two attractive teacher barely keeping alive humor show seems like trying target audience q another reason show becoming failure could writing show scrub excellent show follow leaving viewer odd position knowing whether cry lose hope new sitcom together opinion think guy stop humiliate anymore already,0
redeeming feature movie steve carell like john wayne never seen steve carell stretch far actor matter always play one role perfectly br br marty feldman said comedy must internal consistency men stage sitting garbage can fine bring fifth man stage garbage must explain audience also garbage br br evan accept role messenger god accept profoundly embarrassed anyone impressed way animal follow evan around explained away unthinking doubter trained animal possibly circus terrible flood end everyone see hop ark saved surely thousand people would killed flood post disaster emotional atmosphere end instead congress finally seen light prosecute lone incorrigibly bad congressman profiteering br br gotta admit also liked fish aquarium reacting presence evan,0
get lazy director movie instead setting scene creative way relies boring old zombie clichés br br two unarmed lead get college step van surround zombie yet neither lead bitten bothered direct decent fight scene see lead shove way step br br sometimes zombie limp others run like wind really convenient director set anything like without bothering continuity behaviour zombie br br careful planning lot inspiration movie could much better,0
typical mamet film delivers quiet evenly paced insight make confidence man joe mantegna good explored psychological study noted psychologist lindsay crouse slowly pull world usual nasty consequence cast includes number player found several mamet film steven goldstein jack wallace ricky jay andy potok allen soule william h macy usual good job loved lindsay crouse film often wondered become noted player become perhaps looking right place br br movie proceeds slow pace flat dialog yet maintains level tension throughout logically lead bang ending expect real let ending found uplifting satisfying love movie,1
whilst loved haunted house movie amityville poltergeist made tv adaption susan hill book pack huge punch horror hollywood br br brilliant cast many star heartbeat tv drama great acting fantastic setting portrays life convincingly right ingredient entice viewer powerful ghost story br br herbert wise need blood violence gore send chill spine audience using imagination woman black figure fear dread whose presence never absent first appears br br main character arthur kidd solicitor learns unseen spectre mission settle estate widow dy arthur spends night inside dreary home notice many oddity may haunt day scene unsettling claustrophobic particularly locked room open turn generator close arthur darkness film becomes harrowing put arthur shoe effort shake ghost writer put many chilling addition story example tin soldier appearance one eager learn meaning fact never really learn much widow leaf imagination make unsettling br br widow part look vicious intimidating scene winding generator sent chill woman appears nowhere isolated marshy land howling wind  property appreciate isolating scene inn perhaps horrible thing seen one wish watch hurry show elderly relative often woken night thinking behind sleep br br woman black great tv movie lost gem agree extent internet hype film totally overblown see people disappointed spending best £ think net defeated hidden gem make film like exposed think still brilliant fantastically acted consider greatest ghost story last century,1
never understand studio like universal buy musical butcher bringing screen first thought seeing ava gardner robert walker starring would seeing something mgm musical best time boy wrong disappointed br br one touch venus starred mary martin kenny baker john bole broadway ran performance season gardner walker tom conway play role martin baker bole stage kurt weill ogden nash musical book nash j perelman comeback vehicle mary martin reestablished queen broadway disappointing venture hollywood br br look name went show given responsible book expected see sparkling wit production instead got rather pedestrian screenplay like wit drained best make eve arden playing usual girl friday role tom conway even much eve br br story concern department store window dresser robert walker kiss valuable statue venus spring life person ava gardner course statue go missing conway yell law suspicious walker last person statue br br rest film walker dealing gardner happen reason understand ava course dubbed eileen wilson walker sings couple line singing carried dick haymes olga san juan playing walker friend coworkers course broadway song done singer mary martin kenny baker would kind think haymes would playing walker role least awkward say least br br three song survived score look heart showing incomparable speak low haymes silken baritone shown best advantage speak low sung duet martin baker broadway reason lyric one greatest men verse last century ogden nash done ann ronnell suspect infamous code work br br lee server biography ava gardner make mention brief fling ava robert walker spat current man howard duff duff gardner reunited walker took badly speak gardner camera sure fact best work help matter either br br hopefully repertoire company one touch venus get see way weill nash perelman wrote,0
film first british teen movie actually address reality violent rock roll society rather lucid parody teenage life attempt celebrate work liverpool junior liaison officer opening title point potential delinquent dealt scheme committed second crime however becomes merely pretext following teen drama film epilogue instructed feel responsible sorry delinquent however mixed might seem br br stanley baker play tough detective reluctantly take post juvenile liaison officer hard boiled character role typical baker currently trail notorious arsonist known firefly relish distraction transfer however good police drama led back full circle remarkable turn event back original investigation br br first case lead home two young child mary patrick murphy played real life brother sister duo committed petty theft meet cathie satisfyingly portrayed anne heywood older sister eventually becomes romantically involved quickly becomes obvious squalid environment inner city estate breeding ground juvenile delinquency br br elder brother murphy family johnny leader gang rock roll hoodlum mccallum eye catching turn americanized mixed kid owes like marlon brando previous british star one reminded brando character johnny wild one led leather clad gang rebellious bikers much way film johnny lead gang br br thankfully preachiness earlier dearden crime drama blue lamp apparent instead presented several well drawn character side law drama delinquent romantic interest heywood baker take forefront br br plot whilst time predictable deliver memorable scene disruptive influence rock roll music thought played scene johnny abandon music leading menacing advance police sergeant grippingly memorable piece film however climatic classroom scene bunch terrified school child including mary patrick held hostage gunpoint johnny obviously light real life dumblaine massacre scene seems horrifying understandably film seldom aired available modern audience,1
two year iranian embassy siege involved dramatic sa rescue balcony war argentina falkland island currently taking place better film make gung ho sa film creates iranian hostage siege whilst using britain number one action hero day lewis collins throw edward woodward well known actor got winner hand well maybe film make situation serious enough whilst acting quite second rate like movie long episode professional without formula film go nowhere fast quite predictable maybe cubby brocoli watched film decided ditch lewis collins touted james bond replacement roger moore watch fan lewis collins sa stuff general save time,0
know original hey else said feel unutterably silly paying attention hell came movie make important political social issue fallout atmospheric atomic test seem matter joking dismissal concern alarm raised scientist world time,0
wonder one best musical ever three busby berkely number end movie spectacular make film wonderful incredible non stop patter natural acting cagney blondell keeler also lovely even though may great actress freshness movie see flick today much less usually stilted film even though plot involving setting movie prologue quite dated,1
currently playing german film festival australia thanks peanutqueen especially ariesgemini rundown actor ensemble cast br br australia movie sub titled english french movie often get mainstream release german movie still gather sort commercial audience like bmws mercedes german get right really like film like pq time went quickly lot laugh audience men woman moved speed dating line minute time br br many film overlong one could watched much sort character character development series given time read ariesgemini review reference actor liked work view keeping eye agree actor go onto bigger better thing good character actor fine film see program listed mockumentary mock otherwise felt real quite romantic way br br viva la deutcsh,1
used love movie kid seeing year later actually suck academy might ahead time back almost nothing offer today movie like caddyshack stripe hold much better today steaming dogpile great joke except one liner heard million time br br recently bought dvd hope would gem remembered well way soundtrack widely recognizable hit smash compilation others mentioned frequent voice over terrible thing interesting predicting character line said yep watched movie much back br br reason writing review give two cent movie forgotten sorry say,0
movie time classic music camera shot acting excellent showing movie black white gave much better appearance complemented music perfectly like psycho surprising people commented movie guess hard movie find gave film see movie know talking,1
first saw movie younger child sister told thought would kid movie however remains also incredible movie true subject behind movie ruff also true movie never stop touching heart br br first saw yesterday year later saw first time long time even knew ended knew seen billion bizillion time wept like teeny weeny little baby saw year back finally got idea seriousness film stoped watching yesterday change channel watched end astonished much still made laugh cry think believe mericals belived long time movie got shell opened heart movie impacting also impressed actor especially bobby wanting see movie first time suggest seeing alone tissue ready discover young sweet innocent side side still hope movie touched soul even time trying figure movie helped realize still want life,1
movie got one worst ever seen make dvd story line might clicked film funding writer would cut nonsense sickly scene highly caution parent story line like loose cannon thing drive thru movie maker one would sprung reminded lot quickie film put poor script writing filming br br sensible character whole movie bartender beaver rest film could easily made middle school child give film rating truly awful left entire family sense cheated advice watch,0
particularly moved understated courage integrity l anglaise beautifully acted intellectually visually compelling film thank much monsieur le directeur rohmer,1
honest pimped purple plane snoop dogg helm amusing visual gag would decent concept second commercial maybe minute music video producer committed age old concept comedy sin stretching second material hour half film result predictably lame remainder minute filled typical gamut racist sexist humor fart joke offensive worst painfully unfunny threadbare plot scream weight contrivance best avoided unless drunk stoned,0
movie wife ever walked totally sucked saw omaha even funny look like year old kid wrote humor believe real politician actually movie awful,0
longtime fan original movie bella martha mostly martha everything make movie great enjoyable watch missing one miss slow pace build character style small gesture dominance light mood move dialog think story enough martha kate secluded mario nick clown case thing make one scene great original working copy small alteration take away tension opinion go see original worth inconvenience subtitle,0
strange fate people looking discount bin dvd retailer came across copy deadly instinct collector film either sci fi horror featuring alien monster decided buy mention fact cost five dollar  bargain believe viewing came opinion nothing special research internet discovered film actually called breeder remake tim kincaid horror flick menaced video store mid already seen appreciation deadly instinct grew following discovery br br meteorite crash lawn next private girl college sole teacher ashley played todd jensen  right guy get turned cyborg cult flick cyborg cop four year earlier notice student beginning disappear encountering black haired woman scarred face wearing kinky leather outfit investigation reveals alien creature hitched ride meteorite come earth breed using local womenfolk along local detective belief responsible disappearance ashley try stop monster br br original breeder directed tim kincaid would leave genre make gay porn sci fi horror film actually thinly veiled soft core porn film designed take skin flick genre fan belief one worst film made anyone would want remake quite mystery br br remake actually better effort low budget source film take basic concept alien monster trying interbreed human woman eliminates pornographic element fact film actually tame sex scene nudity even shower scene swearing violence kept minimal level gore may cheat gorehounds make remake film safe whole family kid scared alien monster brings film rating seems bit much br br tameness subject matter aside film fault script featuring good characterization number hole big crash meteor br br mad come review needed bad pun remain interesting br br anyway film setting one problem script failed fix  film set boston building look like belong boston something architecture right another thing college rather large building housing twenty student female course one class  art teacher relationship student janitor somehow escape attention principal mention cop one dimensional stupid real boston pd would good case ever decided sue oh meteor well chance meteor sent saturn check opening credit reach earth onboard propulsion astronomical include chance passenger meteor survive landing br br far acting go todd jensen give dependable performance heroic teacher late kadamba simmons murdered boyfriend shortly film came cut striking figure leather outfit well proving act visual effect run mill credit due filmmaker bringing u cool looking monster,0
like film several reason soft spot film intricately plotted criminal plot like topkapi also enjoy film like topkapi big deal madonna street spoof genre one best one disorganized crime br br corbin bernsen met four con year decides useful bank robbery planning small montana town given detail crime fellow really know shortly sends bernsen arrested two new jersey policeman ed neill daniel roebuck escaped warrant bring back custody four con fred gwynne lou diamond philip ruben blade rus show without clue except bernsen planning something br br first twenty minute film deal four con slowly getting used gwynne philip managing push away suspicion figure trust time see bernsen patiently waiting right moment escape neill roebuck difficult brightest bulb ever existed result two set plot keep juxtaposing throughout film four con trying figure bernsen scheme put operation bernsen trying maintain freedom pursuer regain cabin hopefully find gang take command also third smaller plot involving growing annoyance anger local sheriff hoyt axton idiot new jersey keep getting hair br br many delightful moment film axton egged neil roebuck surrounding house town bernsen supposed hiding inside yelling megaphone come surrounded scene switch huge montana plain bernsen struggling stumbling mile police think moment moment misadventure four con fortunately put oldest gwynne leadership position always guarantee anything one point car start thumb ride truck unfortunately truck carrying manure br br conclusion gang successfully carrying robbery including disabling police car critical time philip specialty car also gem timing suspense comic result film entertaining certainly worth watching,1
want cynical pedantic could point opening raf lancaster bomber mortally wounded nd may somewhat unlikely since german air defence lively adolph hitler day movie viewed cynical audience guess character killed literally last hour war add poignancy fact survived second world war fully appreciate intellect beauty soul powell pressburger masterpiece scene heaven painfully twee viewed today view movie context made raf bomber command lost men war number america lost nam shorter period far far smaller pool active combatant atheist fox hole doubt lost relative conflict view material atheism sensible thing richar attenborough young pilot look awe sight many war hero must openly wept scene remembered much missed comrade survive war also bare mind despite losing several million people seems people germany passing pearly gate obvious nazi go heaven br br plot dashing young pilot peter carter arguing life front celestial court much appeal subtext see matter life death highly political visionary film lament end british empire replaced american ambition little thing show film made people aware american history culture one ethnic mix america even today many briton think usa overwhelmingly composed white anglo saxon protestant fact american white european film rightly contains scene multitude different race confess american peter judged abraham farlan anglophobe first revolutionary killed british force american war independence special relationship britain america special relationship powell pressburger know history come britain america obviously know future br br remember watch movie mind past mind present strange beautiful poignant clever film would never ever work made last year imagine story set revolved around british soldier killed iraq,1
okay absolutely love ben stiller although lukewarm jennifer aniston think girl act least every movie sitcom seen hard get past fake acting sound like standing reading right script movie one good thing ben stiller plot used abused ridiculous many movie type plot say force nature plot old outcome predictable boring knew everything going happen bore watching stiller always delight,0
watched love life holiday filmed film festival florida lovely surprise find british film derivative exploitive beautiful romantic comedy change charm pant audience prepared sit back enjoy gentle pace film transition scene found bit distracting whole think love life winner ruby dust one family pleasant change see british film teen audience littered four letter word try see,1
watching movie never thought defending honest enough begininning much plot real character latch onto except killer acting better capable br br know three ten stellar review saying shot poorly completely useless etc think set supposed fairly well lighting minimal time natural audience used supposed top look like camcorder snuff film fact time quality probably still high true nobody would make tne minute camera work truly bad br br particularly scary disturbing time one two character come across believable soundtrack get tiring time overall put together cleaner lot camcorder movie,0
long way laura otto preminger directs dana andrew star police detective named mark gene tierney beautiful woman haunt nothing else sidewalk end resembles everyone favorite sophisticated murder mystery instead deliciously quotable dialogue get gritty harrowing realism earlier film took place ritzy upper echelon new york society low rent district dark street hoodlum cheap restaurant crummy flat tierney gorgeous ever work department store mannequin life washington height neighborhood doll got fox fur laura mark mcpherson time andrew mark dixon older sadder troubled version cool cop trench coat br br sidewalk end belongs sub genre noir movie police brutality focusing cop control violent impulse like kirk douglas character detective story dixon owes seething contempt crook father criminal past douglas self righteous blind fault andrew burdened repressed guilt self loathing accidentally kill suspect cover action attempt throw suspicion slimy gangster gary merrill vainly pursuing year instead kindly cab driver suspected father dead man estranged mistreated wife morgan gene tierney dixon falling love wife man killed try desperately save father without giving away br br among noir protagonist dana andrew distinction incapable appearing unintelligent even playing average joe usually always come across unusually sensitive perceptive air thoughtful comfort give haunted haunting quality essence actor played ordinary guy cop soldier always tragic undercurrent seeing knowing much conscientious hero marked exhaustion guilt inability ever lighten actor could expressed well bottled anger slow burning pain agonized intelligence mark dixon also muted tenderness muffled warmth even wry humor make heartbreaking come take morgan restaurant regular first time see cold brutal man trading mock insult waitress whose sarcasm hide affection concern dixon asks partner money get lawyer morgan father supply even though recently argued dixon threw punch word loyalty knowing good guy deep see man anguished silence wife resignation hand jewelry pawn dixon goodness come across people reaction much andrew deeply moving performance br br though dana andrew minor star may quintessential forty man go movie hardly ever taking overcoat boxy mid century silhouette fortified fedora glass bourbon cigarette take mouth talk look imprisoned masculine ideal toughness impassivity many noirs romanticize two fisted tough guy sidewalk end offer unflinching portrait reality behind façade gripping melancholy exploration root consequence violence br br andrew sadly underrated time one three protagonist best year life nominated academy award though low key performance far compelling frederic march hammy oscar winning drunk fortunately andrew appeared film ensured immortality last little known film contains best performance seen part marvelous fox film noir set series including number never released title nightmare alley thief highway suggests twentieth century fox may finest record major studio came film noir,1
agree columbo fan movie unnecessary change format columbo unique cop unorthodox police method movie look like remake ordinary detective drama past disturbing point columbo ordinary detective br br two part film left intriguing first figure title movie misleading maybe better title would vanishing bride something similar second columbo hide piece evidence without offering reason viewer least br br feel betrayed disappointed glad peter falk went back usual columbo br br,0
saw insomniac nightmare long ago first time say really found quite good fan dominic monaghan love hole movie take place inside mind acting everyone else little rushed shaky scene could cut work end extra dvd great film greater dom fan ton candid moment set outtake great interview director anyone gone making independent film love watch tess director dom everyone else small close personal set try bang little trippy creepy film pretty enjoyable glad collection,1
show exhausting watch two number drowned world substitute love paradise sit contemplate opening show go history visually thrilling madonna enters stage via gigantic swarovski crystal ball come ceiling huge screen behind show image horse galloping horse play role show due madonna falling one infamous scene madonna crucifix show huge screen count million number many african child orphaned due aid end website address come anyone interested donating go theme environment image politics religion shown interlude show start music love new york ray light part show one favorite dancer funny hand movement towards end music number song disco inferno mixed song dancer make presence known ending full energy show wrap tune lucky star hung hundred golden balloon fall ceiling end message confessed come dvd worth buying came soundtrack show added bonus jonas akerlund great job footage show keeping consistent style tour,1
