review,sentiment
went see random heart friend first thought maybe enjoying movie like good get movie sort award well none friend liked either unbelievable slow much like getting teeth pulled action movie preview walk theatre assumed something would happen smart people walk never walked movie life definitely tough write considering relatively easy please come movie take lot think movie awesome much like movie even come close like category movie hour long like two separate trite story one smoothly sewn together plus soundtrack could even call annoying like seinfeld riff played difference like seinfeld movie jazz riff kept playing sounded highly inappropriate time especially people dealing death plane crash hard explain mean trust awful cannot say enough make people waste money left theatre honestly wanted write movie company demand back sheeesh could gone bowling something money,0
blackwater valley exorcism set small town ranch teenager isabelle kristin erickson found wandering around covered dog blood parent ely randy colton blanche leslie fleming mitchell ranch deeply worried daughter recently considered danger ranch hand ex priest miguel del zamora recognises isabelle symptom possible case possession start speak ancient latin strange voice becomes convinced blanche call priest jacob cameron daddo daughter claire madison taylor ex husband see isabelle confirms miguel suspicion accepts job performing exorcism hopefully banish demon inside isabelle innocent girl free br br directed ethan wiley sat house front telly watching blackwater valley exorcism kept asking question keep sitting awful low budget horror film look like shot camcorder right let honest blackwater valley exorcism complete total utter unashamed rip exorcist literally tick major plot point two share possessed teenage girl start get horny suggest inappropriate thing demon us past misdemeanour worried parent way possessed girl shunned doctor priest troubled past possessed girl tied bed amongst thing suppose blackwater valley exorcism different total crap try give character screen time try get across situation affecting badly written acted end boring film start isabelle already possessed never knew like normal person never really care happening either rest character poorly written fleshed time wondered whether blackwater valley exorcism spoof silly scene vet try sedate possessed isabelle horse tranquilisers state need little prick enters room huge needle hidden behind back scene people punched accompanied silly comedy sound effect film uneven tone result go silly spoof serious horror drama opinion least br br according text opening credit blackwater valley exorcism based actual event yeah right actual event happened film called exorcist piece text also state exorcism scene supervised real priest even decent gore exploitation liven thing scene cut arm dead dog someone stabbed crucifix surprisingly bad language either despite demon trying offencive would imagine reason blackwater valley exorcism adult rating one brief scene pair breast seen one pair naked female breast worth time watching money might spend zero scare atmosphere really amateurish feel whole film br br supposed budget must say wondering money went film look ugly cheap throughout special effect speak production value rock bottom acting poor involved genre favourite jeffrey comb get near top billing opening credit nothing cameo amount five minute screen time even must feared bad going hide behind moustache terrible accent better br br blackwater valley exorcism complete rip exorcist without anything made film classic maker thirty five year late anyway total turkey start finish,0
time change awakening people social upheaval unrest commonplace people spoke view racial tension politics vietnam war sexual promiscuity drug use part daily fabric daily news film attempted encapsulate historical aspect entertaining movie largely succeeded br br film two family followed one white one black first half film story follows family equal basis social family struggle unfortunately second half movie nearly dedicated white family admittedly character family story line intermingled equal consideration given racial aspect century br br whole acting well done historical footage mixed color black white original footage give documentary feel movie movie work fiction clip well known historical figure used set time line br br enjoyed movie situation predictable storyline one sided,0
found pace glacial original story blown way proportion content wife slept try wake felt missing anything br br holmes watson enter house potentially caught unclear could hide entry burglary tool quickly also unclear door study locked preventing servant getting br br thing puzzled right end glint eye broken statute clue supposed represent,0
seen previous movie cédric klapisch therefore expected quality movie psychological depth erasmus student visited several friend studying abroad know well mean spend time abroad mix different culture time yes great fun thought miss movie unfortunately disappointed find l auberge espagnol fails satisfy many way character stereotyped event trite story shallow although quite familiar situation irritatingly cliché go beyond trivial event made movie uninteresting watch gave strong done anything add feeling apart movie lack firm story sometimes look like documentary real life show seriously made movie br br however imagine studied travelled abroad might fun watch,0
watching tenant interesting experience first film ever seen shuttled speed part non action normally watch anything turgid action movie serbo croat indie find fascinating br br tenant frustratingly sluggish orchestrated one main problem script little realistic character dialogue apart set piece character collide structured setting make work film needed feel conceptual lead lack realistic character development everyone seems two dimensional br br worse character bill spear aka snoop dogg found characterization uncomfortable unsympathetic one point even stopped film got annoyed character aggressive violent monotonal delivery lack personality layer apart reactionary switch get really predictable desperately wanted redeeming quality however one reason jar might nebulous time scape film supposedly feel look early noughties securely fixed character might seemed understandable br br lighting film also awkward way soundtrack attempt provide certain gritty jazz infused atmosphere come largely set well lit br br tenant unbelievable film depict real people propose interesting way thinking race identity life writer white black br br strangely came away feeling project needed david lynch eerie clastrophobic obsessive look feel would lifted actor script something quite remarkable,0
shakespeare fan appreciate ken branagh done bring shakespeare back new generation viewer however movie fall short conveying overall intention play ridiculous musical sequence add alicia silverstone stumbling dialogue reminiscent keanu reef much ado nothing poorly cast role equal excruciating endurance viewing,0
got one australia best production completely disagree comment made raminour br br series show depth australian mateship length went help episode five eddy birthday great example really capture australian spirit br br music used throughout series emphasised situation men faced longing home loved one numerous amusing rendition road gundagai capture spirit men fact never forgot home little element singing song took home short br br comment racist towards japanese people thing said change happened japanese treat australian poorly changi represent otherwise would misleading indeed comment screenplay accurate also false six story told series composed real p w experience br br actor superb best opinion matthew newton performance david first episode gut wrenching city boy another nameless face captor see change dramatically first episode violent attack jungle episode see one event changed aware really going always one first help member secret nine br br stephen curry also deserves mention performance eddie birthday amazing going larrikin group sick weak unable take care display mateship episode touch emotional level make proud australian br br study wwii university level found series physically truthful spiritually truthful capture true spirit australian soldier br br well done john doyle capturing spirit changi,1
searching month finally found dvd say damn well worth wait rush rio may well greatest rock dvd existence joking incredible fuss sound crappy true however make concert unwatchable find make feel like actually rio watching concert audience one reason love dvd make feel like actually also geddy alex neil never better form geddy vocal flawless alex guitar playing still incredible neil absolutely word say camera work concert good must say gave u good look everything going stage audience kudos cameraman anyways enough raving go watch rush rio amazed guarantee br br,1
although many audio recording great musician like jascha heifetz survive cinematic televised record limited indeed musical offering like shall music rare gem modern eye ear one quibble plot perceptive viewer put film unique delight proper perspective plot designed appeal young old audience era remains enjoyable day important aspect experience watching classic film see eye moviegoer era br br must take issue reviewer complains film black white feel obliged report student express reservation juvenile complaint reflect limited historical perspective teacher offer educational opportunity explain unique quality black white photography place cinematic history color fact get way good storyline music example black white photography john ford stagecoach like still photograph ansel adam artistic masterpiece br br heifetz wooden could disagree want blatant emotional posturing go rock concert role classical musician like heifetz move audience heifetz emotion conveyed playing body language rare ability extract every emotional nuance music transfer listener listener moved artist br br incidentally one reviewer asked seeing heifetz youtube playing st movement tchaikovsky violin concerto frank mchugh audience film carnegie hall shall music carnegie hall even greater treasure many great classical artist prime blessed film producer least limited instance chose showcase artist still era totally overwhelmed lowest common denominator tripe get today,1
worst direction seen close powerful shot every scene consists nothing close ups loses impact br br tony scott beautiful scenery work backdrop mexico cantinas beautiful estate anthony quinn life dusty town costner roll journey revenge unfortunately catch quick glimpse place camera cut picture big giant head even transition scene costner driving alone across mexico quickly cut close br br score dramatic intrusive dictating every emotion feel story handled much better among thing many people pop nowhere help costner along bad writing br br typical thriller storyline many others taken premise done outstanding thing costner way somewhat similar storyline much better movie br br ending completely anticlimactic suffered melodramatic scoring film movie never going great saw mexico less giant head film might watchable,0
someone teach people made movie difference presenting multiple twist screwing audience even use hypnosis tool cover plot hole whenever find way scene say regressing past snapping think explains everything movie dishonest cheat last minute becomes full blown fiasco,0
recently stumbled across tv showing passion missed opening scene m currier praised vision courage bring strange de balzac tale screen grateful entire cast crew part producing thoroughly fine motion picture must arduous shooting many scene desert cannot comprehend trainer coaxed fine performance leopard simoon adverture call mind another suspenseful adventure naked prey film well known hope find video,1
want much believe quote specifically english subtitle translation actually written spoken rejection letter publisher sends protagonist meant self referential tongue cheek manner director leo carax apparently neglected inform actor true nature film dreadfully earnest portrayal conclude carax actually take seriously else much disdain everyone especially viewing audience bothered letting anyone joke br br auteur able get away making oblique bizarre film élan unique personal style e g david lynch alejandro jodorowsky others use subtler approach still weaving surreal element fabric story e g krzysztof kieslowski david cronenberg later less bizarre work pola x carax throw disjointed mess viewer dare find fault well pacing erratic choppy particular continuity often dispensed superfluous character abound e g gypsy mother child performance overwrought lighting often poor particularly oft discussed sex scene unconnected scene thrust film discernible reason list go br br completely negative noted uplifting exception liked musical score even cacophonous industrial techno music played sprawling abandoned complex main character retreat second half film perhaps reference andy warhol factory much photography countryside beautiful obvious attempt contrast grimy city setting even well middle age cathering deneuve show still performance also one among major character sink bathos br br earlier time would regard film pola x charitably experimentation admirable even experiment work carax try nothing new film pastiche element borrowed countless earlier film several decade movie viewing literally thousand film later simply longer patience kind unoriginal poorly crafted tripe early moment st century one left asking exception jean pierre jeunet director france know make watchable movie anymore rating,0
nominated oscar worst script ever opinion decent story rediculous acting lousy humor every mean possible little self respect please waste time seeing movie although u see actor act leaf dumber watching precious braincells killed watching crap br br warned u br br see movie,0
movie fun board br br essentially follows comedic romp two grave robber th century england move conventional body snatching trafficking vampire zombie dead roswell alien idea roswell alien neither producer think br br funny bet even ron perlman often kiss direct dvd death pretty good one priest turn ringleader rival gang body snatcher br br real joy watch hilarious little film good example larger life ego either side camera,1
way put word bad shapeless paceless laughless vice academy film really experience one third time row writer director rick sloane show even ounce writing directing talent nothing person age believe laugh yet brief nudity plot element make film unsuitable kid lead believe really aimed adult mental capability year old elizabeth kaitan make welcome replacement linnea quigley winningly bubbly cute wonderful big smile thing make viewer smile well watching girl film like watching bunch flower desert covered horse manure,0
enjoyed every moment beautiful film intrigued female painter never heard set exploring life work afterwards could expected found film exactly historically accurate little astounded however negative comment film inaccuracy come guy film biography novel historical film distorts reality work art right film director fully entitled use element reality history create world artemisia wonderful film think brought many people including give negative comment explore life work fascinating artist,1
year old daughter asked watch movie cable tv someone saw revenge nerd movie theater found movie extremely predictable remake nerd simply replaced dork drove crazy able predict precisely would happen scene cast cute especially amanda bynes br br screenwriter chad creasey ashamed writing obvious remake early flick title simply revenge dork perhaps sequel revenge dork,0
movie truly show farce hypocrisy indian society try show one side story side story hidden emotional mental abuse indian child movie show br br indian parent culpable following destroying individuality child making completely dependent parent early age child grow adult physical look remain child mind since everything provided great indian parent child automatically feel need work hard something learn basic human communication human being apart parent br br b show many indian parent try prevent kid making friend going prevent anything start making grow adult br br reason selfishness indian parent expect child take care grow old saving reach age cry loud grown old dependent child since done great service bringing world taking care making intellectually weak br br indian parent age dilapidated body health financially completely insecure feel absolutely need take care since expect kid take care br br west opposite happens people start planning age retirement retire financially secure br br indian parent nothing sort since like said brought kid world better investment br br victim indian parent sure countless indian kid like grown physically still struggling life continue pestering year old cry loud help time br br movie show one side story utter piece junk,0
big fan fred macmurray carole lombard addition charles butterworth enjoyable supporting actor film particularly enjoy well despite good cast one poorest written clichéd picture ever seen given talent money spent make film shocking slip shod writing knew film would tedious time time early film found predicting exactly would happen next always right sort movie savant almost imagination effort went fact seemed almost film long string clichés strung together also found bit irritating fred mistreated carole bad throughout film yet true convention came running end uggh suspense lassie film bring people rescue timmy rope dangling break br br despite tired clichéd script positive film pretty cool seeing fred look like broken lush end film pretty believable looked like eaten shaved slept day also charles butterworth prattle provide mildly humorous moment enough make film look different b movie shame could much better,0
film mildly entertaining one neglect acknowledge numerous incongruity plot sheer lack believability bruce willis jackal never seems live reputation cunning mastermind underworld instead bumbles broad daylight parading mishmash shoddy disguise man never captured even identified beyond audience impressed cleverness daring considering price demand service exorbitant million method decidedly low budget stupid br br pursuit least ridiculous behavior show sense expertise instead relying half baked conjecture sends traversing across country whim incredibly far fetched guess maybe bought boat maybe chicago etc etc invariably lead straight jackal yet escape clumsy grasp br br richard gere whose irish accent fade like distant radio station play inexplicable role imprisoned convict released jail work alongside fbi actually make compatible partner mean amateurish inept professional pal one point actually confronts infamous jackal unfortunately fbi although trust enough leave sight fail equip weapon mean communication kind operation running br br film also appears overly reliant gruesome violence entirely superfluous provides suspense whatsoever supposedly stealthy jackal act like demented senseless serial killer eliminating people sport writing victim cheek blood br br film action scene predictable unrealistic many moment ruined melodrama movie poorly executed many level one bright spot ever consistent sidney poitier avoid movie mood think watch br br,0
recently saw movie international business class expecting anything another boring documentary say love documentary hard bad luck movie class imagine surprise movie actually movie came br br film tell cultural difference work place need cooperate get anywhere culture clash show different world differently perceive someone come along give u wake call would highly recommend film anyone business want laugh yes funny br br well cheer,1
sorry see rated low many people series started good first season good br br people tend forget beginning something look end good look total end result sad lot usual character died damn lot nice new character br br please attach character attach series plot please understand like boone died augur died well need done imagine everyone keep living whole series lot danger time come face die would invincible way always keep tension survive die realize people attach self character favorite character augur one could get every computer wanted one mysterious could thing computer one else could br br wish make one statement people vote negative series started good deserve low rating look final season instead total see good series started see much enjoyed,1
american come expect crapiness par course come horror unknown director directing unknown actor acting unknown writer truly expect suck suck becomes night success br br night success weekend month success blow start finish recommendation go knowing suck enjoy something better keep back way back burner entertaining way watching elderly cross busy street rush hour expect much almost never get hit actual car lot hoopla,0
haunting film boast really creepy house good effect work sound work cast seems believe everything around real house scene make jump sinister aspect went hill house past found interesting genuinely creepy moment film liked way ghost manifested sheet curtain house jerry goldsmith score gave right atmosphere sound design voice popping around wish could happened something little intense jan de bont pg rating contend think held back little much poltergeist scared silly saw many year ago still hold haunting could used scene pure terror ending little anticlimactic overall enjoyed acting good moment make jump wish scared,1
ok brought cheese love run became phenomenon anorexic twin became popular bob saget started making paycheck instead really funny stand people knew dave coulier life good simple one great american classic humorous always brought home good lesson differ norm liked last season like home improvement child get older lot script dare say could gone much later anyway gave wholesome funny story line bob saget,1
listen people ill give better review movie friend love jill johnson played camilla belle babysits mendrakis house someone break wondering got house went garage likely anyway listen worst acting amazing acting great story think benefit jill shes fast runner track team got alive lol br br cool movie quite scary check happy masterpiece listen people site good trust good reviewing movie future movie critic totally want buy movie see amazingly awesome,1
independent b w dv feature consistently shock amazes amuses ability create insane situation find humor interest hilarious ridiculous stuff yet absurd much film heart reality keep film grounded keep entire piece drifting complete craziness therein lie real message film survive world gone mad seems heart film insane wall thing get leon yr old paperboy protagonist always try keep together like child forever trying catch balloon floating away everything work best everyone want br br acting film could went far top exceptional cast really keep piece cohesive van meter perhaps best bunch performance shine absurd diseased tic character film overlook sudden outburst see real person underneath br br majkowski true genius take utmost ridiculous plot twist keep real script cast help keep whole thing afloat true testament skill majkowski involved film grating plot character never work nerve majkowski taken film could abrasive repugnant somehow given heart humor unique film missed br br,1
read book based adaptation bother hated every character show miranda slutty selfish mumbled miserably appalling dialogue sister total wimp worst depiction manic depression ever seen degree psychology accurate fact mentioned realise troy supposed bipolar thought normal slightly grumpy teenager br br saving grace stupid show david tennant whose brilliantly psychotic performance thing got watch second half br br clearly writer producer show done research troy mental problem remotely accurate forensics involved twist ending spot mile big ole dummy br br utter garbage,0
usa movie like take nap long hot sunday afternoon feel great close eye let worry drift away soon lost one intense lucid dream know dreaming still wake want go flow soon kind weird alice wonderland story complete character think could dream telling kind crazy stuff war peace taking trip past even future br br dream start get heavier feel like going path control maybe want wake try open eye destruction sadness confusion scary voice telling could truth could lie seeing image flicker change get clear even want see brain creating br br finally lost myth world realize end come end world end dream wake next br br maybe write dream know dream like happen often better pay attention br br maybe crack beer forget whole thing bad idea forget,1
definitely definitely worst film ever seen question asked contradictors opinion might argue title judged criterion others since independent low budget film c mon already  amateurism meager innovation horrifying br br agreeing everything said film example mind numbingly weak acting bad take another go shooting scene god damn thing found annoying total lack common sense script assuming thing existed production obvious absence dialogue respect viewer girl switched personality several time seemed show absolutely sing rationality even brain five relatively fit girl one slight female psychopath  gang br br thing regarded somewhat conquest title camera leaving van time thus viewer seeing everything inside rest film good idea executed exponentially dreadfully br br oh way movie nothing like blair witch project cloverfield title filmed hand held camera  effect trait used cleverly breathtaking case excuse inadequate cinematography,0
