review,sentiment
one word describes film bad idea movie even made got dennis hopper star film stuart gordon better director hopper much better actor film plain stupid like square pig idea interesting love scene involving cyborg avoid film cost,0
saying movie extremely hard follow frustrating sit putting mildly also saying current available print dark dreary scratchy abysmally edited painfully dubbed seemingly censored almost unwatchable shape also correct film dire need good remastering full uncut original negative seeing reasonably atmospheric director award catalonia film festival might actually worth trouble maybe impossible tell current condition kind movie actually start fairly interesting discount completely senseless pre credit opening sequence involves deranged cat killing snake loving little girl named gerda girl mom carla mónica randall laid eyeliner little bit splash gasoline around garage torch brat seemingly crazy young gerda go visit estranged photographer ex boyfriend mario john cihangir caffari vacation work desperate get away carla begs employer set assignment assignment scowl sorry head door well mario assigned photograph witch mountain somewhere pyrenees believe get destination get sight hottie beach named delia patty shepard snap picture taking bikini top slightly peeved claim single writer two flirt decide would swell idea went trip mountain together stop place pack bag mario suddenly hears loud sinister music delia claim hearing thing br br two begin trip mountain taking stop local inn spend night encounter weird partially deaf crazy eyed innkeeper victor israel delia claim someone spying window next day trance wanders mountain eventually located mario hop jeep run finding someone steal wheel forced walk piece eventually finding jeep undamaged foot small ancient seeming abandoned village almost like someone trying intentionally lure well see exactly happened village encounter friendly old woman named zanta ana farra claim person still living let stay home mario take picture abandoned city develops eerily full people slightly creeped delia begin leave get stuck treacherous fog pull camp night rest movie voodoo doll black cat transforming sexy woman satanic ritual performed lady bra deadly fall cliff yeah coincidentally carla estranged wife turn one witch take place semi darkness quite honest know hell going time inconclusive open ending additional slap face anyone suffer rest senseless mess br br honestly thing stand really good first actress shepard great barbara steele kind dark mysterious beauty also excellent music score credited fernando garcia morcillo chanting song aided immensely making film atmospheric location work fairly decent said print ugly make lick sense proceed caution one,0
guy richie third proper film counting god awful swept away complex action thriller concerned gambling gangster chess fan richie previous effort probably hate revolver much twist turn richie stalwart jason statham play jake newly released ex con wreak revenge ridiculously named dorothy macha superbly ott ray liotta instead get embroiled couple con one andre rap outfit outkast throw u audience number red herring throughout film becomes extremely tedious high point mess movie bit restaurant dialogue get turned favour superbly shot slow mo shootout set beethoven moonlight sonata revolver flawed work truly awful far richie best would still lock stock film school homework assignment would graded must try harder,0
comparison movie last detail made chaser flatter stretch interstate highway west texas like scenery desert nothing much distinguish even fact female prisoner transported two navy escort time around one cast come well lame script surprising dennis hopper director give much space one ever writes memoir think,0
astonishing people saw art saw poorly filmed shaky hand held camera generally badly acted unscripted mess seemed like high school film project kid experimenting black white film making injecting mound poetry place story art film make watched theatre people starting fit giggle u included endless stupidity self indulgent meandering mess believe seem endless finished candy popcorn would walked theatre two dozen people packed left looking something interesting,0
well movie actually one redeeming quality made funniest season one episode mstk wish rhino released one instead crawling hand,0
many goofy thing movie possibly name br br bogart character name  whip mccord easy leave boy make humphrey sound good long curly hair silly sideburn black bart get complete spur sure shade lipgloss got wearing none flattering br br cagney character jim kincaid lipstick favor either man swallowed hat entire film could find hat fit even little pant tight rear blow smoke gun one many time know mean think br br casual bogart cagney fan figure might change pace see western favor forget thought even horse look embarrassed look bored br br fairness admit western least favorite film genre still seen much much better br br comedy level high camp oklahoma kid work otherwise viewer beware therefore see must see every western b true cagney bogie completist c comment appeal woah,0
basil rathbone nigel bruce sherlock holmes dr watson respectively second universal series established mean written prologue famed detective legendary span time help comfortably set thing present era early br br offering holmes go different disguise rathbone prominent feature likely people really recognize true identity protects physicist hand nazi well holmes greatest nemesis professor moriarty played lionel atwill scientist developed bomb sight greatly aid aerial bombardment promised plan british moriarty want get hold sell nazi br br good entry boosted bit participation properly villainous atwill cast moriarty though george zucco slouch adventure sherlock holmes always intriguing watching holmes greatest enemy engaging witty banter together needle last eh holmes,1
love chan wook park know expect film brutal poetic tragic artistic splash grim humor thirst clearly park style loved every second cinematography every shot gorgeous creative story blend shakespearean tragedy murderous love gothic horror layered character drama character complex plenty moral ambiguity go around even sociopathic character evokes sympathy direction restrained performance nuanced like sympathy mr vengeance many subtlety take first viewing chan wook park intelligent bold consistently surprising filmmaker unpredictable scene go brutal heart wrenching laugh loud hilarious instant closer lady vengeance sympathy mr vengeance far top comical like lady vengeance incredibly rich thought provoking rewarding br br like beautifully told vampire story let right one fan chan wook park seeing thirst obvious easily one best film,1
basically skimmed movie enough catch watch plot tell truth kind boring spot make sense reason watched movie first place see chace crawford hot movie hair kind weird still hot br br however despite hot chace really make film guess plot bad really threw fact cuss like every sentence hard express anger without saying f word every time cussing annoying whole flashy camera shaking thing gave headache br br although plot ok found film bore dramatic cut scene chace lol anyways worth renting unless die hard fan specific cast member like oh yeah cast hot girl hot chace best,0
may academy award admittedly pretty cheesy much fun nothing make smile like bill ted lovable optimistic hilarious bill ted great way unwind br br although love excellent adventure bogus journey funnier death flippin hilarious bill ted even endearing people give grief loving movie really pretentious movie watcher say even bit entertaining like probably also fan wayne world dude car dumb dumber admit though foolish make grin turn tickle box watch kick giggle,1
larry mcmurty masterpiece stand good western lonesome dove ever take role woodrow call great portrayal style also easy see looking use stepping stone v series version writer knew keep flavor alive william peterson awesome geeky c guy character play guy seems br br deserve enjoyed enjoy western br br star,1
refreshing watch beautiful movie director maintained focus main subject without venturing side plot doctor family story hospital patient typical bollywood assembly line product kept narrative simple comprehend made sure actor true character supposed portray rustic way grandfather clinic cold unemotional behavior surgeon zeal social worker gave movie feel genuineness also glad director fall temptation adding song special effect reduce level anand safar couple scene toward end movie boy visiting blind child blind worker workplace also final scene boy clap sound splashing bird chirping sure make eye misty br br many bollywood player realize oscar committee member value simplicity subject genuineness brevity movie glitz glamor shwaas certainly better nomination lagaan dealt subject already beaten death mpaa member willingly going suffer hour jingoistic drama lot song dance br br look forward movie director sandeep sawant future,1
originally aired abc movie week involves two young innocent female college student railroaded prison camp little southern town allowed phone call nobody know follows rape torture beating humiliation degradation leading disturbing conclusion br br tv version time grim nudity beating pretty tame overall feeling sleaziness wore one unrated version even worse plentiful nudity violence extreme one particularly disgusting sequence see cry female prisoner forced strip lesbian guard us yuck nothing wrong exploitation film one go brink get feeling filmmaker enjoy poor woman tortured degraded shoved face like supposed enjoy needlessly downbeat ending help br br giving acting good actually make movie harder watch sick sleazy film recommended,0
laughed hard since granny got caught wringer say one pothead hilarious quasi spoof val lewton george romero walking dead movie come love loath depending personal taste year br br story young actor pair play ghoulish prank rest troupe one spooky night visit cemetery island artistic director alan pretend bring dead back life conducting highly stylized ritual br br way much screen time misspent amateur dialog includes lame witticism melodrama kind unnecessary filler commentary alan stop irritating laughter way much action kick come close end film worth wait br br saw one late night local station television program ran film much like one one scared age might laugh way bitter end probably reason nowadays people still wear striped hip hugger,0
movie scary moment great use music film angle build suspense obvious director ethan wiley scriptwriter ellary eddy waste time researching subject matter also make question claim exorcism scene overseen genuine catholic bishop br br amongst many inconsistency br br jacob roman catholic priest first meet outside church wearing academic robe clericals rather typical alb chasuble surplice academic robe commonly worn protestant minister liturgical denomination roman catholic priest br br jacob priest quote obscure disturbing scripture angel taking weapon attribute st paul verse st paul writing neither bible even find gnostic scripture br br jacob tell bishop believe demon possession turn request study exorcism complete later day within minute talking possessed isabelle sure possible little unrealistic see father damien priest psychologist original exorcist bit realistic portrayal skeptic turned believer br br miguel former priest turned farmhand first try exorcism isabelle quote scripture quote back say see know psalm corrects psalm wrong br br miguel former priest got done performing exorcism making sign cross calling name christ applying holy water etc tell jacob believe church believe god maybe conflicted jacob enlists put home made vestment another go anyway br br miguel former roman catholic priest cross backwards eastern orthodox style hispanic roman catholic used priest crossed forehead sternum left side right side chest br br read little side story get notion satan messing whole family isabelle even end hard say sure anyone really guilty image head demonic trickery except sheriff pretty clear guilty br br positive side isabelle creepy opinion best part whole movie liked plot twist claire br br sure movie meant serious spoof br br listening running commentary cameron daddo ethan wiley inclined believe joke,0
future society military component recruit rather candidate chosen birth culled nursery designated spend entire life service government given war machine body soul reason protect serve personal identity name rank autonomy whatsoever fate whose destiny predetermined soldier directed paul anderson starring kurt russell scenario hard bleak movie begin depicting training soldier advancing period time preadolescence adulthood russell sergeant todd best best glimpse career discharge duty exemplary manner campaign campaign born soldier even best cannot go forever day arrives todd peer longer elite new generation soldier created product advanced genetics technology todd generation suddenly obsolete follows story man must fight life struggling discover sense humanity individuality trait new soldier known two thing entire life fear discipline russell give commanding performance todd soldier else must obey order without question suppressing emotion individual thought line movie russell speaks volume eye role demonstrates fact one appreciated actor time disappear entirely character todd credit ability part created someone quite different done given todd depth credibility someone lesser talent could easily rendered nothing pretentious superficial stereotype notable performance also turned connie nielsen sandra jason isaac colonel mekum rounding supporting cast jason scott lee memorable caine one new generation soldier sean pertwee mace gary busey captain church michael chiklis jimmy pig mark bringleson rubrick anderson delivered action film message cautionary tale transcends genre science fiction soldier reminds u importance keeping humanity life intact entertaining way making u consider alternative like bleak future world good movie make whole lot difference much like mad max movie ultimately uplifting going make take pause think kind universe must live together share rate one,1
one best moodiest vampire tale ever love movie really character great even location story indeed picture big budget production absolutely worth seeing br br ok fault especially name castle location movie mistake typically almost every horror movie br br scenery fit perfect story close reality say honest visit romania vacation br br opinion best part subspecies series,1
rarely make comment felt compelled spare others pain endured watching movie stupid implausible overall story detail simply suspend disbelief problem start early see government researcher tooling around new porsche dining team restaraunt look like castle overlooking capitol building washington c kind life government salary hah get worse toward end bad guy start killing good guy latter group act stupidly want die order cleanse gene pool special effect pretty good producer money buy lead actor great film screenplay direction moronic many people wondered whether deliberate intelligence behind paul verhoeven previous facially stupid movie showgirl starship trooper movie stop wondering plain bad,0
saw boring sunday morning morning well drawn fact outdoor movie hoping find nice scenery view limited go back forth spot hate using called hi tech stuff like motorola blue tooth headset using eliminate use walkie talkie funny look like amateur like advertising badly designed alien ware laptop could link satellite find people say tv movie ending bad look like cut short eliminating use rescue helicopter etc,0
must admit one lou costello film actually saw theater seen v must admit lou really enjoyable get girl first time seeing dorothy provine perform course fell love like many others day seen work done enjoyed one performance great race one reason bought disc first place br br every comment movie tell one movie lou costello bud abbott true lou lived would made many really good job rely old routine get laugh one sorry little man patterson n j get chance br br hope come dvd time add comedy sci fi collection,1
doll master example lousy horror film fallen somewhere space two well established genre horror film emotional drama film seems like doll master try hard scary horror film fails noise doll moving like taken croak kayako ju crawl like sadako esquire killing doll remember cute version chucky compared child play film superb story seems nothing brilliant camera shot brilliance acting taken away cause plot br br watch expecting great shock,0
expecting star trek d premiered slight d wonderful show right however never really gave fan wanted enterprise show similarity original trek differs enough original way make idea exploration exciting u one primary ingredient made original loved another ingredient success relationship evolved crew member viewer really cared deeply crew enterprise much promise area well chemistry bakula blalock seems promising sexual tension show often become crutch feel tension enterprise lead much say alot typical think deal grand scale character different race specie even get interesting idea television also note performance blalock convincing vulcan pol bacula really whimsy strength character delivers great performance rest cast delivered good performance also gripe follows theme good different little light hearted liking need something little grand orchestral maybe something little electronic sound would suffice one complaint sell many add could fix selling less ad making show two parters otherwise end seeing show final act getting wrapped way quickly one complaint voyager,1
saw movie thursday night really boring day expectation rather negative movie ever watched jimmy american version taxi queen latifah ask seriously movie cute drew barrymore always sweet almost fell love fallon character meet cute nerd like movie like excellent simple sweet necessary sunday thursday even sport fan something american movie baseball fascinates probably fact sport norway br br first comment ever haha,1
shot heart wonderful brilliantly illustrates plight gary gimore convicted murder requested death shot heart show ordeal gilmore family torn hatred went movie incredible psychological study wonderfully depressing uplifting,1
though derivative labyrinth still stand highlight mid half six year old show finally story allows welling show grown actor easy playing character embodiment truth justice american way weekly basis little variation performance permitting show one might react discovers knew may lie quite believable br br welling rose occasion marvelously br br always michael rosenbaum handicapped lex delivered kristen kreuk sweet believed lana allison mack ever present chloe also scored slightly rocker version br br use annoying hum background added tone installment made engaging drama,1
rosenstrasse intimate film one epic proportion could kept away many film goer looking pianist similar plot fortunately von trotta good screenwriter opts feminist peep era much illustrated colorful exterior little analyzed term intimacy point view ordinary aryan german rather jewish standpoint rosentrasse find strength unsung burden people trapped within historical circumstance emerge victim pace film introspective poignantly slow meditative besides character vivid transition generation passing time deftly crafted rosenstrasse masterpiece narrative flaw well discerned another fault lie trivial cinematography unable capture intensity internal drama lived character nevertheless film worth seeing finally rosenstrasse part last trend german film dealing ghost nightmarish past trend includes excellent film nowhere africa recently controversial downfall would recommend film know read beyond image,1
br br step aside hollywood veteran wayan brother asked thats hollyweird demanded thats got however like many recent decision one stupendous mistake br br director touch today audience attempting bring back physical pratfall gag place funny dialogue disaster knew audience knew cast knew br br shame ever consider changing director two wayan brother played two four primary character without farce sad one br br sp br br,0
excited concept favorite comic book hero television sorely disappointed end result br br amazing thing wall crawling despite visibility cable think nick hammond peter parker visibly different build guy stunt spider suit could tell two different actor br br granted also spot modern spider man movie looking tobey macguire looking cgi trained eye experience working cgi still version could better despite lack special fx br br web hokey looked like rope seemed wrap around thing rather stick giving spider mobile ride around hello web slinger people br br sorry mean get worked beloved wall crawler deserved better,0
whatever rating give boom superb location photography sardinia rome otherwise hardcore addict elizabeth taylor downward phase richard burton miscasting phase tennessee williams wrote milk train stop anymore supposed fond adaptation play apparently one taylor reportedly hated burton needed money br br whatever amount hill bean taylor posturing fuming shrill manner exploding servant exchanging bad baby talk less noel coward seems visitor another film finally appears br br campy among taylor fan probably considered must see kind thing sit one without drink hand way ahead sadly film signified end taylor taken seriously film actress even winning two oscar burton equally disastrous critic called bomb judge dare,0
hulk hit theater long dvd old incredible hulk tv show popped attempt cash craze saw similar occurrence year prior spider man cartoon appeared dvd coincide hero big screen debut company leap opportunity ride financial coattail hot brand br br fact picture never surfaced shelf wal mart featured hero clobbered box office summer say lot guess everyone involved would rather forget fair fantastic four bad everyone say let rephrase unentertaining negative review might suggest br br veteran television actor alex hyde white remember role lead way reed richards brilliant scientist along crew gain bizarre power outer space mishap left ability stretch contort body outrageous length future wife sue storm rebecca staab suddenly turn invisible brother johnny jay underwood may ignite poor ben grimm michael bailey smith lovable lug whose body morphs mass craggy orange rock br br friend becoming accustomed called upon rescue world certain chaos seems reed old colleague victor von doom joseph culp living name villainous jeweler ian trigger exactly helping old lady cross street either hero save day course like superhero movie question br br striking fantastic four amateurish virtually every aspect dialog lame tired sound like written junior high drama class acting unpolished make third rate afternoon soap opera look like shakespeare special effect surprisingly good considering minuscule budget still positively embarrassing moment human torch fully ignites body instance entire movie briefly turn cartoon hear production meeting oh one notice intrigued action mean really cartoon least give mannequin fire held string prior scene foursome come earth spaceship crash pure teen backyard fare crew simply found field lit vaguely spaceship like object fire remnant major disaster br br course whole lot work script fairly coherent story simplified reed ben decide go outer space simply drop storm house ask care join really easy sort thing require oh know year training expertise world writer seemed inspired underrated genius display full house rerun bad may nothing compare painfully clichéd dr doom pulled right awful superhero cartoon right evil laugh slamming clenched fist table punctuate remark comic book least fantastic four ever featured villain obscenely one dimensional br br ultimately fantastic four saved complete turkey damn innocent tell people involved little talent experience really tried know final result would embarrassing impression big break people would flock theater bear repeating virtually money work sure half eaten cool thing costume thing considered well many flaw finished product fair amount fun comic book fan,0
never understood appeal show acting poor debra jo rupp notable exception plot episode trite uninspiring dialogue weak joke unfunny painful try sit even half episode furthermore link show extremely tenuous beyond style dress scenery background used show seems nothing modern sitcom old unfunny clichéd script modern sitcom dressed depicting show twenty year ago hope gain nostalgic viewer something like happy day wonder year employ technique much effectively actually pleasure watch contrast horrible pathetic excuse show,0
old man mouse cartoon would believe men created equally evil kill men order stop hitler bad hitler killing jew well buy mr mouse guess paint pretty picture make cute cartoon reality reality,0
